{
  "brands": {
    "attribute": "data-theme on <html> (or any ancestor)",
    "contract": "Switching swaps only [data-theme] semantic values; components/apps need zero per-brand code. shadcn vars (--primary, --background, …) are re-pointed at --ds-* in kraken-theme.css, so Tailwind classes theme too. Never hard-code brand values.",
    "default": "jit",
    "values": {
      "brand": "primary #298EE5 (blue, --ds-color-brand-500), sharp 0px, Noto Sans",
      "jit": "primary #FFD242 (yellow, --ds-color-jit-400), rounded 6px, Moderat JIT"
    }
  },
  "corePrinciples": [
    "Every color/spacing/radius/typography value uses a --ds-* token — no hex/px literals in components, ever.",
    "Bind at the right layer: component colors via L3 (or semantic); never a primitive when an L3 token exists.",
    "State is CSS, never a prop: hover/focus/active are pseudo-classes; the only state prop is disabled.",
    "shadcn parity: names/props follow shadcn verbatim; variant values are the exact lowercase Figma enum strings.",
    "Form inputs ship as *Field wrappers (InputField, TextareaField, SelectField, RadioGroupField) adding label/description/errorMessage/mandatory.",
    "Icons are lucide-react components passed as leftIcon/rightIcon/icon (or children) — never baked in; Figma icon-picker value = lucide name.",
    "WCAG 2.1 AA: 4.5:1 text / 3:1 UI contrast, visible focus ring (--ds-color-border-focus), full keyboard support.",
    "Generated files (tokens.css, registry.json, docs/, manifests/ except overrides/) are never hand-edited."
  ],
  "figmaCodeConventions": [
    "State axis → CSS, not a prop.",
    "iconOnly=true ↔ icon-only semantics — Button expresses it as the iconOnly prop; elsewhere render only an icon child.",
    "Figma variant values are already the exact code enum strings — lowercase, 1:1, no transform (Figma variant=destructive → variant=\"destructive\").",
    "Instance-swap (icons) → a lucide-react icon passed as leftIcon / rightIcon / icon (or children).",
    "Disambiguate duplicate Figma names by node ID (see Part 4).",
    "Sub-parts are NOT separate files — they compose into the parent's .tsx as exported parts (dialog/header → DialogHeader in dialog.tsx).",
    "Brand/theme (jit ⇄ brand) and light/dark values are not props — they cascade from [data-theme] on an ancestor via the token layer."
  ],
  "install": {
    "bootstrap": "npx shadcn add @kraken/theme (pulls the tokens item automatically)",
    "component": "npx shadcn add @kraken/<name>",
    "mcp": "claude mcp add kraken-ui -- npx -y @kraken-ui/mcp",
    "registryNamespace": "@kraken"
  },
  "scales": {
    "fontSizes": "xs sm md lg xl 2xl…6xl = 12 14 16 20 24 32 40 48 56 72px",
    "radius": "none xs sm md lg xl 2xl 3xl full = 0 2 4 6 8 12 16 24 9999px",
    "spacing": "px steps 0-256 (0 1 2 3 4 5 6 7 8 10 12 16 20 24 28 32 36 40 44 48 56 64 80 96 128 160 192 256); aliases component-xs…2xl (6→32px), layout-xs…2xl (16→96px)",
    "typographyRoles": "display{md,lg,xl,2xl} heading{sm,md,lg,xl} body{xs,sm,md,lg} label{sm,md,lg} link{xs,sm,md,lg} overline"
  },
  "shadcnDivergences": [
    {
      "area": "Button variants",
      "kit": "primary/secondary/tonal/ghost/destructive/destructive-secondary/destructive-ghost",
      "shadcn": "default/outline/secondary/ghost/destructive/link (map: default→primary, outline→secondary)"
    },
    {
      "area": "Button sizing",
      "kit": "--ds-button-size-* tokens + iconOnly prop",
      "shadcn": "utility classes + size=\"icon-*\""
    },
    {
      "area": "Alert prop",
      "kit": "type",
      "shadcn": "variant"
    },
    {
      "area": "Tabs variant",
      "kit": "badge",
      "shadcn": "default"
    },
    {
      "area": "AlertDialog",
      "kit": "prop-driven AlertDialogContent (title/description/primaryActions/secondaryActions); AlertDialogCancel alias provided for copy-paste compat",
      "shadcn": "composable Header/Footer/Title/Action/Cancel/Media"
    },
    {
      "area": "Avatar",
      "kit": "prop-driven (src/fallback), AvatarStack",
      "shadcn": "composable AvatarImage/AvatarFallback, AvatarBadge/AvatarGroup"
    },
    {
      "area": "Progress",
      "kit": "single <Progress value label>",
      "shadcn": "composable Track/Indicator/Label/Value"
    },
    {
      "area": "Toast",
      "kit": "Base UI Toast (toast, toastManager)",
      "shadcn": "sonner package"
    },
    {
      "area": "Drawer",
      "kit": "Base UI dialog",
      "shadcn": "vaul"
    },
    {
      "area": "EmptyMedia slot",
      "kit": "data-slot=\"empty-media\"",
      "shadcn": "data-slot=\"empty-icon\""
    },
    {
      "area": "Slider range slot",
      "kit": "data-slot=\"slider-indicator\" (Base UI naming)",
      "shadcn": "data-slot=\"slider-range\""
    }
  ],
  "sources": [
    "design.md",
    "MAPPING.md"
  ],
  "system": "Kraken UI Kit (JIT DS 2.0) — shadcn-based, Figma-first, 3-layer --ds-* tokens, 2 brands.",
  "tokenArchitecture": {
    "layers": [
      "L1 global: primitive ramps/scales (--ds-color-jit-400, --ds-spacing-16) — never bind component colors here.",
      "L2 semantic: shadcn-named roles (--ds-color-primary, --ds-color-border-focus) — the ONLY per-brand layer.",
      "L3 component: per-component knobs (--ds-button-primary-fillhover) referencing L2 — what components consume."
    ],
    "naming": {
      "colorPrimitive": "--ds-color-{ramp}-{shade}",
      "colorSemantic": "--ds-color-{role}[-{state}]",
      "component": "--ds-{component}-{variant}-{property}",
      "contentBorder": "--ds-color-{content|border}-{role}",
      "radius": "--ds-radius-{size}",
      "spacing": "--ds-spacing-{px} | --ds-spacing-{context}-{size}",
      "status": "--ds-color-status-{kind}-{part}",
      "typography": "--ds-typography-{role}{size}-{prop}"
    }
  }
}
